<?xml version="1.0" encoding="UTF-8"?>
<OpenMunicipio
	xmlns="http://www.w3schools.com"	
	xmlns:xsi="http://www.w3.org/2001/XMLSchema-instance"
	xsi:schemaLocation="http://www.w3schools.com OpenMunicipioDataImport.xsd"
	xmlns:xi="http://www.w3.org/2001/XInclude">
	<Groups>
		<Group name="Partito dell'Amore" acronym="PdA">
			<Person
				name="Pippo"
				last_name="Poppi"
				birth_date="1982-07-26"
				birth_place="Loreto (AN)"
				sex="m"
				ssn="PPPPPP86L26E690K" />
			<Person
				name="AAAA"
				last_name="BBBB"
				birth_date="1982-07-26"
				birth_place="Loreto (AN)"
				sex="f"
				ssn="AAABBB86L26E690K" />
			<Person
				name="XXXX"
				last_name="YYYY"
				birth_date="1982-07-26"
				birth_place="Loreto (AN)"
				sex="f"
				ssn="XXXYYY86L26E690K" />
		</Group>
		<Group name="Partito dell'Odio" acronym="PdO">
			<Person
				name="Paperino"
				last_name="Paolino"
				birth_date="1982-07-26"
				birth_place="Loreto (AN)"
				sex="m"
				ssn="PPPPPP86L26E690K" />
			<Person
				name="Gino"
				last_name="Lollobriggido"
				birth_date="1982-07-26"
				birth_place="Loreto (AN)"
				sex="f"
				ssn="AAABBB86L26E690K" />
			<Person
				name="Mister"
				last_name="Muscolo"
				birth_date="1982-07-26"
				birth_place="Loreto (AN)"
				sex="f"
				ssn="XXXYYY86L26E690K" />
			
		</Group>
	</Groups>
</OpenMunicipio>
